{
  "$schema": "https://json-schema.org/draft/2020-12/schema",
  "title": "AI Foundry Desk Recipe",
  "type": "object",
  "additionalProperties": false,
  "required": ["recipeVersion", "id", "version", "origin", "skills", "tools", "prerequisites", "checks", "rollback"],
  "properties": {
    "recipeVersion": { "const": 1 },
    "id": { "type": "string", "pattern": "^[a-z0-9][a-z0-9-]{0,63}$" },
    "version": { "type": "string", "minLength": 1 },
    "origin": { "type": "string", "minLength": 1 },
    "skills": { "type": "array", "items": { "type": "object", "additionalProperties": false, "required": ["id", "source", "targets"], "properties": { "id": { "type": "string", "pattern": "^[a-z0-9][a-z0-9-]{0,63}$" }, "source": { "type": "string", "minLength": 1 }, "targets": { "type": "array", "uniqueItems": true, "items": { "enum": ["claude-code", "codex", "antigravity", "pi", "hermes", "grok"] } }, "localOverlay": { "type": "string" } } } },
    "tools": { "type": "array", "items": { "type": "object", "additionalProperties": false, "required": ["id", "command", "source", "version"], "properties": { "id": { "type": "string", "pattern": "^[a-z0-9][a-z0-9-]{0,63}$" }, "command": { "type": "string", "minLength": 1 }, "source": { "type": "string", "minLength": 1 }, "version": { "type": "string", "minLength": 1 }, "checksum": { "type": "string", "pattern": "^sha512-[A-Za-z0-9+/]+={0,2}$" } } } },
    "prerequisites": { "type": "array", "items": { "type": "string" } },
    "checks": { "type": "array", "items": { "type": "string" } },
    "rollback": { "type": "object", "additionalProperties": false, "required": ["managedOnly"], "properties": { "managedOnly": { "const": true } } }
  }
}
